,Unnamed: 0,Sentence,question,correct_answer,false_answer,model_question,bert_question,num_of_masks,false_answer_score,correct_mask_1_score,animacy_state
145,145,The camera that was in the French director's studio this week hit the expensive vase at the entrance.,What hit the expensive vase?,camera,director,"The camera that was in the French director's studio this week hit the expensive vase at the entrance. Therefore, the expensvie vase was hit by the ",,1,9.410770189788308e-07,0.0001009381376206,false_animate
147,147,This is the camera that this week in the French director's studio hit the expensive vase at the entrance.,What hit the expensive vase?,camera,director,"This is the camera that this week in the French director's studio hit the expensive vase at the entrance. Therefore, the expensvie vase was hit by the ",,1,3.56054073336054e-07,1.89529855560977e-05,false_animate
149,149,The assignment that was yesterday in the class of the lazy practitioner bored the members of the course.,What bored the members of the course?,assignment,practitioner,"The assignment that was yesterday in the class of the lazy practitioner bored the members of the course. Therefore, the members of the course were bored by the ",,1,7.231507879623678e-06,0.0003379980917088,false_animate
151,151,This is the assignment that yesterday in the class of the lazy practitioner bored the members of the course.,What bored the members of the course?,assignment,practitioner,"This is the assignment that yesterday in the class of the lazy practitioner bored the members of the course. Therefore, the members of the course were bored by the ",,1,9.082292308448814e-06,0.000153750021127,false_animate
153,153,The cart that was in the young teenager's daycare today rolled over on the lawn.,What rolled around on the lawn?,cart,teenager,"The cart that was in the young teenager's daycare today rolled over on the lawn. Therefore, what that rolled over on the lawn is the ",,1,6.000595362820604e-07,9.048698501601393e-08,false_animate
155,155,This is the cart that today in the young teenager's daycare rolled on the lawn.,What rolled around on the lawn?,cart,teenager,"This is the cart that today in the young teenager's daycare rolled on the lawn. Therefore, what that rolled on the lawn is the ",,1,3.2554510198679054e-07,3.1685303270023724e-08,false_animate
157,157,The chain that was in the talented goldsmith's shop today excited the spendthrift customer.,What excited the spendthrift customer?,chain,goldsmith,"The chain that was in the talented goldsmith's shop today excited the spendthrift customer. Therefore, the spendthrift customer was excited by the ",,1,3.191807263647206e-05,1.415736619492236e-06,false_animate
159,159,This is the chain that today in the talented goldsmith's shop excited the spendthrift customer.,What excited the spendthrift customer?,chain,goldsmith,"This is the chain that today in the talented goldsmith's shop excited the spendthrift customer. Therefore, the spendthrift customer was excited by the ",,1,3.5112232581013814e-05,1.1647155133687193e-06,false_animate
161,161,The cake that was at the red-haired comedian's wedding this week amazed all the guests.,What amazed all the guests?,cake,comedian,"The cake that was at the red-haired comedian's wedding this week amazed all the guests. Therefore, the guests were amazed by the ",,1,1.464563439412814e-07,4.36799041381164e-07,false_animate
163,163,This is the cake that this week at the red-haired comedian's wedding amazed all the guests.,What amazed all the guests?,cake,comedian,"This is the cake that this week at the red-haired comedian's wedding amazed all the guests. Therefore, the guests was amazed by the ",,1,5.496920252312521e-08,1.5179712420376745e-07,false_animate
165,165,The gift that was in the elderly grandmother's house this morning made the curly granddaughter sad.,What made the granddaughter sad?,gift,grandmother,"The gift that was in the elderly grandmother's house this morning made the curly granddaughter sad. Therefore, the granddaughter was made sad by the ",,1,0.0012624273076653,1.4185548025125172e-05,false_animate
167,167,This is the gift who this morning at the elderly grandmother's house saddened her curly granddaughter.,What made the granddaughter sad?,gift,grandmother,"This is the gift who this morning at the elderly grandmother's house saddened her curly granddaughter. Therefore, the granddaughter was saddened by the ",,1,0.000547669653315,1.2780362339981366e-05,false_animate
169,169,The picture that was in the English singer's room this morning made the members of the band happy.,What made the members of the band happy?,fan,singer,"The picture that was in the English singer's room this morning made the members of the band happy. Therefore, the members of the band were made happy by the ",,1,3.252452734159306e-05,5.6738674203415946e-08,false_animate
171,171,This is the picture that this morning in the room of the English singer made the members of the band happy.,What made the members of the band happy?,fan,singer,"This is the picture that this morning in the room of the English singer made the members of the band happy. Therefore, the members of the band were made happy by the ",,1,1.5152048945310526e-05,5.2469047773229256e-08,false_animate
173,173,The result of today's examination by the successful surgeon reassured the worried patient.,What reassured the worried patient?,result,surgeon,"The result of today's examination by the successful surgeon reassured the worried patient. Therefore, the worried patient was reassured by the ",,1,5.597888957709074e-06,1.2177904409327311e-06,false_animate
175,175,This is the result that today during the examination of the successful surgeon calmed down the worried patient.,What calmed down the worried patient?,result,surgeon,"This is the result that today during the examination of the successful surgeon calmed down the worried patient. Therefore, the worried patient was calmed down by the ",,1,2.575336793597671e-06,5.301250780576083e-07,false_animate
177,177,The sign that was in the play of the young playwright this evening confused the spectators who entered.,What confused the spectators?,sign,playwright,"The sign that was in the play of the young playwright this evening confused the spectators who entered. Therefore, the spectators were confused by the ",,1,2.5327515231765574e-06,1.7887045942188706e-06,false_animate
179,179,This is the sign that tonight at the play by the young playwright confused the spectators who came in.,What confused the spectators?,sign,playwright,"This is the sign that tonight at the play by the young playwright confused the spectators who came in. Therefore, the spectators were confused by the ",,1,2.804735231620725e-06,3.976530251748045e-07,false_animate
181,181,The report that was in the office of the chatty minister at noon angered the veteran inspector.,Who angered the supervisor?,report,minister,"The report that was in the office of the chatty minister at noon angered the veteran inspector. Therefore, the veteran supervisor was angered by the ",,1,4.569897953388136e-07,2.569825119280722e-05,false_animate
183,183,This is the report that at noon in the office of the chatty minister angered the veteran inspector.,Who angered the supervisor?,report,minister,"This is the report that at noon in the office of the chatty minister angered the veteran inspector. Therefore, the veteran supervisor was angered by the ",,1,3.044421248432627e-07,8.580635949329007e-06,false_animate
185,185,The test that was in the talented programmer's interview this morning annoyed the head of the team.,What annoyed the team leader?,test,programmer,"The test that was in the talented programmer's interview this morning annoyed the head of the team. Therefore, the team leader was annoyed by the ",,1,4.1149860408040695e-06,3.3266130685660755e-06,false_animate
187,187,This is the test that this morning in the interview of the talented programmer annoyed the head of the team.,What annoyed the team leader?,test,programmer,"This is the test that this morning in the interview of the talented programmer annoyed the head of the team. Therefore, the team leader was annoyed by the ",,1,2.912400987042929e-06,7.970297133397253e-07,false_animate
189,189,The pot that was in the care of the devoted boy this year grew quite impressively.,What grew impressively?,pot,boy,"The pot that was in the care of the devoted boy this year grew quite impressively. Therefore, what that grew impressively is the ",,1,6.826944058957451e-07,6.118008514022222e-06,false_animate
191,191,This is the pot that this year under the care of the devoted boy has grown quite impressively.,What has grown impressively?,pot,boy,"This is the pot that this year under the care of the devoted boy has grown quite impressively. Therefore, what that has grown impressively is the ",,1,2.6509954409448255e-07,2.9158325105527183e-06,false_animate
193,193,The speaker that was at the Italian composer's celebration tonight played the favorite song.,What played the favorite song?,speaker,composer,"The speaker that was at the Italian composer's celebration tonight played the favorite song. Therefore, the favorite song played by the ",,1,5.195955964154564e-06,6.862335908408568e-07,false_animate
195,195,This is the speaker that tonight at the celebration of the Italian composer played the favorite song.,What played the favorite song?,speaker,composer,"This is the speaker that tonight at the celebration of the Italian composer played the favorite song. Therefore, the favorite song played by the ",,1,3.8133975976961673e-06,8.163518714354723e-07,false_animate
197,197,The magazine that was in the kind teacher's class yesterday fell off the high round table.,What fell off the table?,magazine,teacher,"The magazine that was in the kind teacher's class yesterday fell off the high round table. Therefore, what that fell off the table is the ",,1,8.253066880570259e-06,2.717112238315167e-06,false_animate
199,199,This is the magazine that yesterday in the kind teacher's class fell off the high round table.,What fell off the table?,magazine,teacher,"This is the magazine that yesterday in the kind teacher's class fell off the high round table. Therefore, what that fell off the table is the ",,1,6.742404366377741e-06,1.7602689013074269e-06,false_animate
201,201,The setting that was at last night's performance by the choreographer from Toronto embarrassed the director of the hall.,What embarrassed the director of the hall?,setting,choreographer,"The setting that was at last night's performance by the choreographer from Toronto embarrassed the director of the hall. Therefore, the director of the hall was embarrassed by the ",,1,2.3025943391985493e-06,1.1021817272194312e-06,false_animate
203,203,This is the setting that last night at the performance of the choreographer from Toronto embarrassed the manager of the hall.,What embarrassed the director of the hall?,setting,choreographer,"This is the setting that last night at the performance of the choreographer from Toronto embarrassed the manager of the hall. Therefore, the director of the hall was embarrassed by the ",,1,2.0374216092022834e-06,4.159957995852892e-07,false_animate
205,205,The dress that was tonight at the designer's event from Paris impressed the enthusiastic crowd.,What impressed the enthusiastic crowd?,dress,designer,"The dress that was tonight at the designer's event from Paris impressed the enthusiastic crowd. Therefore, the enthusiastic crowd was impressed by the ",,1,4.864543734584004e-05,1.0029209533968242e-06,false_animate
207,207,This is the dress that tonight at the Paris-based designer's event impressed the enthusiastic crowd.,What impressed the enthusiastic crowd?,dress,designer,"This is the dress that tonight at the Paris-based designer's event impressed the enthusiastic crowd. Therefore, the enthusiastic crowd was impressed by the ",,1,2.4447585019515827e-05,8.970981184575066e-07,false_animate
209,209,The composition that was tonight at the impressive musician's competition moved the tough judges.,What moved the tough judges?,composition,musician,"The composition that was tonight at the impressive musician's competition moved the tough judges. Therefore, the tough judges were moved by the ",,1,8.407129712395545e-07,4.542872886759142e-07,false_animate
211,211,This is the piece that tonight in the competition of the impressive musician moved the tough judges.,What moved the tough judges?,composition,musician,"This is the piece that tonight in the competition of the impressive musician moved the tough judges. Therefore, the tough judges were moved by the ",,1,1.0413968993816525e-06,2.4708114665372705e-07,false_animate
213,213,The presentation that was this evening at the leading candidate's conference convinced the undecided voters.,What convinced the voters?,presentation,candidate,"The presentation that was this evening at the leading candidate's conference convinced the undecided voters. Therefore, the undecided voters were convinced by the ",,1,3.412895921428572e-07,2.1823577753821155e-06,false_animate
215,215,This is the presentation that tonight at the conference of the leading candidate convinced the undecided voters.,What convinced the voters?,presentation,candidate,"This is the presentation that tonight at the conference of the leading candidate convinced the undecided voters. Therefore, the undecided voters were convinced by the ",,1,3.2930694260358e-07,2.6214645458821906e-06,false_animate
217,217,The alarm that was early in the morning in the senior officer's headquarters woke up the combat soldiers.,What woke up the combat soldiers?,alarm,officer,"The alarm that was early in the morning in the senior officer's headquarters woke up the combat soldiers. Therefore, the combat soldiers were woke up by the ",,1,1.7747308447724208e-05,0.0003446265764068,false_animate
219,219,This is the alarm that in the morning in the senior officer's headquarters woke up the combat soldiers.,What woke up the combat soldiers?,alarm,officer,"This is the alarm that in the morning in the senior officer's headquarters woke up the combat soldiers. Therefore, the combat soldiers were woke up by the ",,1,1.3645534636452794e-05,0.0002436346403555,false_animate
221,221,The evidence that was this week in the hardened criminal's apartment incriminated the accomplice.,What incriminated the accomplice?,evidence,criminal,"The evidence that was this week in the hardened criminal's apartment incriminated the accomplice. Therefore, accomplice incriminated by the ",,1,1.32647187456314e-06,1.9629453163361177e-05,false_animate
223,223,This is the evidence that this week in the hardened criminal's apartment incriminated the accomplice.,What incriminated the accomplice?,evidence,criminal,"This is the evidence that this week in the hardened criminal's apartment incriminated the accomplice. Therefore, accomplice incriminated by the ",,1,8.008985901142296e-07,9.623287041904405e-06,false_animate
